{
  "id": "albero-silenzioso",
  "version": 1,
  "title": "L'Albero che Non Parlava Più",
  "world": "ambiente",
  "topic": "piantare",
  "series": "emma-pietrolino",
  "episode": 3,
  "ageBands": { "5-7": "5-7.json" },
  "formats": ["illustrated", "audio"],
  "togetherOnly": false,
  "keyPhrase": "Non con la forza. Con la cura.",
  "gesture": "Piantare un seme in un vasetto e dargli un po' d'acqua ogni giorno.",
  "parentCard": "parent.md",
  "sources": [
    "Legambiente, materiali di educazione ambientale per la primaria (da verificare)",
    "Progetti scolastici di orto e semina per l'infanzia (da verificare)"
  ],
  "status": "draft"
}
